<?xml version="1.0" encoding="UTF-8"?>
<!DOCTYPE song SYSTEM "ej3.dtd">
<song length="6:20" anio="1978">
  <title>Hot Cop</title>
  <composers>
    <composer>
      <nombre>Henry</nombre>
      <apellidos>Beolo</apellidos>
    </composer>
  </composers>
  <producers>
    <producer>
      <nombre>Jacques</nombre>
      <apellidos>Morali</apellidos>
    </producer>
  </producers>
  <publiser>PolyGram</publiser>
  <artists>
    <artist>Village People</artist>
  </artists>
</song>
